{
  "timestamp": "2026-03-01T16:16:24.410302",
  "config": {
    "processed_dir": "data/processed/m1_f8",
    "feature_dim": 8,
    "feature_cols": [
      "ret_1m",
      "hl_range",
      "co_change",
      "vol_log1p",
      "pos_log1p",
      "minute_sin",
      "minute_cos",
      "is_session_open"
    ],
    "lookback": 60,
    "horizons": [
      1,
      5,
      20,
      60
    ]
  },
  "dataset": {
    "total_samples": 57418,
    "symbols": 3,
    "symbol_sample_counts": {
      "DCE.JM": 5726,
      "SHFE.AG": 44334,
      "CZCE.MA": 7358
    }
  },
  "validation": {
    "total_checks": 19,
    "valid_checks": 19,
    "invalid_checks": 0,
    "success_rate": 1.0
  },
  "random_samples": [
    {
      "symbol": "DCE.JM",
      "x_start": 60820,
      "x_end": 60879,
      "segment_id": 489,
      "x_shape": [
        60,
        8
      ],
      "y_shape": [
        4
      ],
      "x_has_nan": false,
      "x_has_inf": false,
      "y_has_nan": false,
      "y_has_inf": false,
      "segment_consistent": true,
      "errors": [],
      "valid": true
    },
    {
      "symbol": "CZCE.MA",
      "x_start": 289805,
      "x_end": 289864,
      "segment_id": 2408,
      "x_shape": [
        60,
        8
      ],
      "y_shape": [
        4
      ],
      "x_has_nan": false,
      "x_has_inf": false,
      "y_has_nan": false,
      "y_has_inf": false,
      "segment_consistent": true,
      "errors": [],
      "valid": true
    },
    {
      "symbol": "SHFE.AG",
      "x_start": 321055,
      "x_end": 321114,
      "segment_id": 1894,
      "x_shape": [
        60,
        8
      ],
      "y_shape": [
        4
      ],
      "x_has_nan": false,
      "x_has_inf": false,
      "y_has_nan": false,
      "y_has_inf": false,
      "segment_consistent": true,
      "errors": [],
      "valid": true
    },
    {
      "symbol": "SHFE.AG",
      "x_start": 23515,
      "x_end": 23574,
      "segment_id": 137,
      "x_shape": [
        60,
        8
      ],
      "y_shape": [
        4
      ],
      "x_has_nan": false,
      "x_has_inf": false,
      "y_has_nan": false,
      "y_has_inf": false,
      "segment_consistent": true,
      "errors": [],
      "valid": true
    },
    {
      "symbol": "SHFE.AG",
      "x_start": 101855,
      "x_end": 101914,
      "segment_id": 589,
      "x_shape": [
        60,
        8
      ],
      "y_shape": [
        4
      ],
      "x_has_nan": false,
      "x_has_inf": false,
      "y_has_nan": false,
      "y_has_inf": false,
      "segment_consistent": true,
      "errors": [],
      "valid": true
    },
    {
      "symbol": "SHFE.AG",
      "x_start": 255120,
      "x_end": 255179,
      "segment_id": 1471,
      "x_shape": [
        60,
        8
      ],
      "y_shape": [
        4
      ],
      "x_has_nan": false,
      "x_has_inf": false,
      "y_has_nan": false,
      "y_has_inf": false,
      "segment_consistent": true,
      "errors": [],
      "valid": true
    },
    {
      "symbol": "CZCE.MA",
      "x_start": 231545,
      "x_end": 231604,
      "segment_id": 1901,
      "x_shape": [
        60,
        8
      ],
      "y_shape": [
        4
      ],
      "x_has_nan": false,
      "x_has_inf": false,
      "y_has_nan": false,
      "y_has_inf": false,
      "segment_consistent": true,
      "errors": [],
      "valid": true
    },
    {
      "symbol": "SHFE.AG",
      "x_start": 47400,
      "x_end": 47459,
      "segment_id": 275,
      "x_shape": [
        60,
        8
      ],
      "y_shape": [
        4
      ],
      "x_has_nan": false,
      "x_has_inf": false,
      "y_has_nan": false,
      "y_has_inf": false,
      "segment_consistent": true,
      "errors": [],
      "valid": true
    },
    {
      "symbol": "SHFE.AG",
      "x_start": 445755,
      "x_end": 445814,
      "segment_id": 2610,
      "x_shape": [
        60,
        8
      ],
      "y_shape": [
        4
      ],
      "x_has_nan": false,
      "x_has_inf": false,
      "y_has_nan": false,
      "y_has_inf": false,
      "segment_consistent": true,
      "errors": [],
      "valid": true
    },
    {
      "symbol": "SHFE.AG",
      "x_start": 20390,
      "x_end": 20449,
      "segment_id": 119,
      "x_shape": [
        60,
        8
      ],
      "y_shape": [
        4
      ],
      "x_has_nan": false,
      "x_has_inf": false,
      "y_has_nan": false,
      "y_has_inf": false,
      "segment_consistent": true,
      "errors": [],
      "valid": true
    }
  ],
  "symbol_samples": [
    {
      "symbol": "DCE.JM",
      "x_start": 45065,
      "x_end": 45124,
      "segment_id": 363,
      "x_shape": [
        60,
        8
      ],
      "y_shape": [
        4
      ],
      "x_has_nan": false,
      "x_has_inf": false,
      "y_has_nan": false,
      "y_has_inf": false,
      "segment_consistent": true,
      "errors": [],
      "valid": true
    },
    {
      "symbol": "DCE.JM",
      "x_start": 124425,
      "x_end": 124484,
      "segment_id": 1008,
      "x_shape": [
        60,
        8
      ],
      "y_shape": [
        4
      ],
      "x_has_nan": false,
      "x_has_inf": false,
      "y_has_nan": false,
      "y_has_inf": false,
      "segment_consistent": true,
      "errors": [],
      "valid": true
    },
    {
      "symbol": "DCE.JM",
      "x_start": 256500,
      "x_end": 256559,
      "segment_id": 2161,
      "x_shape": [
        60,
        8
      ],
      "y_shape": [
        4
      ],
      "x_has_nan": false,
      "x_has_inf": false,
      "y_has_nan": false,
      "y_has_inf": false,
      "segment_consistent": true,
      "errors": [],
      "valid": true
    },
    {
      "symbol": "SHFE.AG",
      "x_start": 113215,
      "x_end": 113274,
      "segment_id": 655,
      "x_shape": [
        60,
        8
      ],
      "y_shape": [
        4
      ],
      "x_has_nan": false,
      "x_has_inf": false,
      "y_has_nan": false,
      "y_has_inf": false,
      "segment_consistent": true,
      "errors": [],
      "valid": true
    },
    {
      "symbol": "SHFE.AG",
      "x_start": 549020,
      "x_end": 549079,
      "segment_id": 3203,
      "x_shape": [
        60,
        8
      ],
      "y_shape": [
        4
      ],
      "x_has_nan": false,
      "x_has_inf": false,
      "y_has_nan": false,
      "y_has_inf": false,
      "segment_consistent": true,
      "errors": [],
      "valid": true
    },
    {
      "symbol": "SHFE.AG",
      "x_start": 341445,
      "x_end": 341504,
      "segment_id": 2012,
      "x_shape": [
        60,
        8
      ],
      "y_shape": [
        4
      ],
      "x_has_nan": false,
      "x_has_inf": false,
      "y_has_nan": false,
      "y_has_inf": false,
      "segment_consistent": true,
      "errors": [],
      "valid": true
    },
    {
      "symbol": "CZCE.MA",
      "x_start": 120300,
      "x_end": 120359,
      "segment_id": 966,
      "x_shape": [
        60,
        8
      ],
      "y_shape": [
        4
      ],
      "x_has_nan": false,
      "x_has_inf": false,
      "y_has_nan": false,
      "y_has_inf": false,
      "segment_consistent": true,
      "errors": [],
      "valid": true
    },
    {
      "symbol": "CZCE.MA",
      "x_start": 209240,
      "x_end": 209299,
      "segment_id": 1707,
      "x_shape": [
        60,
        8
      ],
      "y_shape": [
        4
      ],
      "x_has_nan": false,
      "x_has_inf": false,
      "y_has_nan": false,
      "y_has_inf": false,
      "segment_consistent": true,
      "errors": [],
      "valid": true
    },
    {
      "symbol": "CZCE.MA",
      "x_start": 141590,
      "x_end": 141649,
      "segment_id": 1137,
      "x_shape": [
        60,
        8
      ],
      "y_shape": [
        4
      ],
      "x_has_nan": false,
      "x_has_inf": false,
      "y_has_nan": false,
      "y_has_inf": false,
      "segment_consistent": true,
      "errors": [],
      "valid": true
    }
  ]
}